{
  "component": {
    "id": "features",
    "description": "C-07: the feature store's provisioning job. Loads static spatial reference before a run.",
    "heartbeat_interval_seconds": 5.0
  },
  "clock": {
    "endpoint": "http://clock:8090",
    "routes": {
      "snapshot": "/clock/snapshot",
      "control": "/clock/control"
    },
    "mode": "accelerated",
    "stale_after_gap": 4,
    "timeout_seconds": 5.0
  },
  "seed": {
    "root": 20260826,
    "stream": "features"
  },
  "broker": {
    "url": "mqtt://broker:1883",
    "client_id": "features",
    "keepalive_seconds": 30
  },
  "logging": {
    "level": "INFO"
  },
  "features": {
    "store": {
      "dsn": "postgresql://drogna@observations:5432/drogna",
      "schema": "features",
      "provisioning_role": "drogna",
      "runtime_roles": [
        "drogna_ingest",
        "drogna_read",
        "drogna_telemetry"
      ],
      "tables": {
        "bathymetry": "bathymetry",
        "coastline": "coastline"
      }
    },
    "domain": {
      "latitude": {
        "minimum": 48.0,
        "maximum": 50.0
      },
      "longitude": {
        "minimum": -6.0,
        "maximum": -3.0
      }
    },
    "bathymetry": {
      "latitude_count": 21,
      "longitude_count": 31,
      "shallow_depth_m": 40.0,
      "deep_depth_m": 1200.0,
      "roughness_m": 15.0
    },
    "coastline": {
      "vertex_count": 31,
      "variation_degrees": 0.02
    }
  }
}
